{
  "id": "prLSlfYXlQ8Nmsa8gyVi6PPZUmA=",
  "partitionkey": "{10.0.0.28:8081 -> 10.0.0.2:65473}",
  "source": "ctd.mbta.com/trike-1234",
  "specversion": "1.0",
  "time": "2023-01-29T13:51:54.990000Z",
  "type": "com.mbta.ocs.tmov_heavy_rail.v1",
  "data": {
    "counter": 70877,
    "timestamp": "2025-06-06T13:17:37.632951-04:00",
    "transitLine": "R",
    "trainUid": "54838C33",
    "latitude": 42.374346,
    "longitude": -71.030170,
    "trainTag": "normal",
    "leadCar": "2507",
    "leadCarDisplay": "1507", 
    "dispatchTags": [ "K", "D" ],
    "ashmont": false,
    "tripUid": "981498C2",
    "expressLocation": ""
  }
}
